{
  "algorithm_config_overrides": null,
  "brief": {
    "en": "Drowsiness has pegged at 100 and fatigue has climbed to 56 -- the rest threshold is crossed and AICA now recommends a stop. Until the driver actually reaches the SA/PA they are still driving, so the assistant keeps pushing the same energize track, now at its highest fit of the drive: peak confidence right before the stop.",
    "ja": "眠気は上限の100に達し、疲労も56まで上昇 — 休憩の閾値を超え、AICAは休憩を推奨する。SA/PAに着くまではまだ運転中のため、アシスタントは同じエナジャイズ系の曲を推し続け、フィットスコアはこの走行で最高値に — 停車直前が確信のピーク。"
  },
  "category": "situation",
  "contrast_with": null,
  "expectation": {
    "expected_service": {
      "top_should_be_in": [
        "humming_karaoke",
        "call_response_driving",
        "quiz",
        "ranking_creation"
      ]
    },
    "expected_top": {
      "arousal_band": "high"
    },
    "gradient": "none",
    "hypothesis": "drowsiness pegs at 100, fatigue 56, rest now recommended, still driving -> the SAME high-arousal track tops with its highest fit yet, and the assistant is still offering a driving service to bridge the gap to the stop",
    "override_required": false,
    "top_fit_min": 0.249
  },
  "family": "journey",
  "journey": {
    "id": "journey-a",
    "label": {
      "en": "A · The Boring Commute",
      "ja": "A・退屈な通勤"
    },
    "of": 5,
    "step": 3
  },
  "label": {
    "en": "A · 3/5 — Rest Recommended",
    "ja": "A・3/5 — 休憩推奨"
  },
  "preset_id": "preset-journey-a-3-rest-recommended",
  "schema_version": "1.0.0",
  "world": {
    "catalog_ref": {
      "dataset_hash": "sha256:83d8079c7a81bc6afbd01cdba65fe2330de66b900a113723814fa938fce516cd",
      "dataset_id": "soundcharts-grounded-spotify-compatible-demonstration-seed-1042",
      "dataset_version": {
        "schema_version": "1.0.0",
        "spotify_audio_features_reference_version": "1.0.0",
        "spotify_track_reference_version": "1.0.0"
      }
    },
    "control_inputs": {
      "dataset_id": "soundcharts-grounded-spotify-compatible-demonstration-seed-1042",
      "lifecycle_stage": "before_rest_until_stop",
      "matrix_version": "v1",
      "motion_state": "driving",
      "trigger_purpose": "rest_recommended"
    },
    "driver_profile": {
      "age_band": "30s",
      "cancelled_content_plans": [],
      "catalog_item_recency_state": {},
      "catalog_item_usage_level": {},
      "changed_from_items": [],
      "completed_items": [],
      "content_proposal_acceptance_confidence": {},
      "content_proposal_acceptance_rate": {},
      "content_recovery_confidence": {},
      "content_recovery_rate": {},
      "content_tag_recency_state": {},
      "content_tag_usage_level": {},
      "gender": "unspecified",
      "genre_affinity_v1_enabled": false,
      "hobby_interest_tags": [],
      "manually_selected_items": [],
      "oshi_id": null,
      "oshi_mode": "off",
      "oshi_registered": false,
      "oshi_tags": [],
      "oshi_type": null,
      "played_items": [],
      "repeated_items": [],
      "scene_content_tag_usage_level": {},
      "scene_genre_usage": null,
      "scene_service_usage_level": {},
      "scheduled_event_tags": [],
      "scheduled_event_timing": null,
      "scheduled_event_type": null,
      "service_proposal_acceptance_confidence": {},
      "service_proposal_acceptance_rate": {},
      "service_recency_state": {},
      "service_recovery_confidence": {},
      "service_recovery_rate": {},
      "service_usage_level": {},
      "skipped_items": [],
      "usage_by_genre": null
    },
    "situation": {
      "active_service": null,
      "child_present": false,
      "destination_tags": [],
      "drowsiness_level": 100,
      "estimated_min_until_rest_spot": null,
      "fatigue_level": 56,
      "monotony_level": 100,
      "motion_state": "driving",
      "multiple_passengers": false,
      "night_state": "day",
      "recent_service_rejections": [],
      "rest_spot_type": "unknown",
      "road_type": "highway",
      "route_tags": [
        "highway"
      ],
      "traffic_state": "normal"
    }
  }
}
