{
  "algorithm_config_overrides": null,
  "brief": {
    "en": "The honest floor: an unknown driver (no oshi, no history, no genre data) on an ordinary highway drive with a neutral situation. Scores stay low BY DESIGN — a third of the model's weight (Preference/History) has nothing to act on. This control makes every personalized preset's lift meaningful by comparison.",
    "ja": "正直な基準値：未知のドライバー（推し・履歴・ジャンル情報なし）が中立な状況で通常の高速道路を走行。設計上スコアは低いまま — モデル重み（嗜好/履歴）の1/3が働く材料を持たない。この対照があるからこそ、他の個人化プリセットの上振れに意味が生まれる。"
  },
  "category": "baseline",
  "contrast_with": null,
  "expectation": {
    "expected_service": {
      "top_should_be_in": [
        "music_playlist",
        "humming_karaoke"
      ]
    },
    "expected_top": {
      "arousal_band": "mid"
    },
    "gradient": "none",
    "hypothesis": "cold-start: no personalization -> low top score, documents the honest floor",
    "override_required": false,
    "top_fit_min": 0.072
  },
  "family": "baseline",
  "journey": null,
  "label": {
    "en": "Cold-start neutral (control)",
    "ja": "コールドスタート中立（対照）"
  },
  "preset_id": "preset-coldstart-neutral",
  "schema_version": "1.0.0",
  "world": {
    "catalog_ref": {
      "dataset_hash": "sha256:83d8079c7a81bc6afbd01cdba65fe2330de66b900a113723814fa938fce516cd",
      "dataset_id": "soundcharts-grounded-spotify-compatible-demonstration-seed-1042",
      "dataset_version": {
        "schema_version": "1.0.0",
        "spotify_audio_features_reference_version": "1.0.0",
        "spotify_track_reference_version": "1.0.0"
      }
    },
    "control_inputs": {
      "dataset_id": "soundcharts-grounded-spotify-compatible-demonstration-seed-1042",
      "lifecycle_stage": "active_driving_content",
      "matrix_version": "v1",
      "motion_state": "driving",
      "trigger_purpose": "route_music"
    },
    "driver_profile": {
      "age_band": "30s",
      "cancelled_content_plans": [],
      "catalog_item_recency_state": {},
      "catalog_item_usage_level": {},
      "changed_from_items": [],
      "completed_items": [],
      "content_proposal_acceptance_confidence": {},
      "content_proposal_acceptance_rate": {},
      "content_recovery_confidence": {},
      "content_recovery_rate": {},
      "content_tag_recency_state": {},
      "content_tag_usage_level": {},
      "gender": "unspecified",
      "genre_affinity_v1_enabled": false,
      "hobby_interest_tags": [],
      "manually_selected_items": [],
      "oshi_id": null,
      "oshi_mode": "off",
      "oshi_registered": false,
      "oshi_tags": [],
      "oshi_type": null,
      "played_items": [],
      "repeated_items": [],
      "scene_content_tag_usage_level": {},
      "scene_genre_usage": null,
      "scene_service_usage_level": {},
      "scheduled_event_tags": [],
      "scheduled_event_timing": null,
      "scheduled_event_type": null,
      "service_proposal_acceptance_confidence": {},
      "service_proposal_acceptance_rate": {},
      "service_recency_state": {},
      "service_recovery_confidence": {},
      "service_recovery_rate": {},
      "service_usage_level": {},
      "skipped_items": [],
      "usage_by_genre": null
    },
    "situation": {
      "active_service": null,
      "child_present": false,
      "destination_tags": [],
      "drowsiness_level": 40,
      "estimated_min_until_rest_spot": null,
      "fatigue_level": 28,
      "monotony_level": 40,
      "motion_state": "driving",
      "multiple_passengers": false,
      "night_state": "day",
      "recent_service_rejections": [],
      "rest_spot_type": "unknown",
      "road_type": "highway",
      "route_tags": [
        "highway"
      ],
      "traffic_state": "normal"
    }
  }
}
