{
  "algorithm_config_overrides": null,
  "brief": {
    "en": "The gridlock hasn't moved in a while — the worst point of the jam. Drowsiness (70) and fatigue (55) have both climbed and monotony is pegged at 100. The assistant's energize pick should show its highest fit of the whole journey here.",
    "ja": "渋滞は一向に動かない — この渋滞で最悪の局面。眠気（70）と疲労（55）がともに上昇し、単調度は100に張り付く。覚醒を促す一曲のフィット感は、この旅程を通じて最も高くなるはず。"
  },
  "category": "situation",
  "contrast_with": null,
  "expectation": {
    "expected_service": {
      "top_should_be_in": [
        "humming_karaoke",
        "call_response_driving",
        "quiz",
        "ranking_creation"
      ]
    },
    "expected_top": {
      "arousal_band": "high"
    },
    "gradient": "none",
    "hypothesis": "worst point of the jam: drowsiness 70 + fatigue 55 + monotony pegged at 100 → the energize track's fit peaks for the journey, still inattentive-prevention, still a driving service",
    "override_required": false,
    "top_fit_min": 0.223
  },
  "family": "journey",
  "journey": {
    "id": "journey-d",
    "label": {
      "en": "D · Stuck in traffic",
      "ja": "D・渋滞に巻き込まれて"
    },
    "of": 3,
    "step": 2
  },
  "label": {
    "en": "D · 2/3 — Jam drags on",
    "ja": "D・2/3 — 渋滞が長引く"
  },
  "preset_id": "preset-journey-d-2-jam-drags",
  "schema_version": "1.0.0",
  "world": {
    "catalog_ref": {
      "dataset_hash": "sha256:83d8079c7a81bc6afbd01cdba65fe2330de66b900a113723814fa938fce516cd",
      "dataset_id": "soundcharts-grounded-spotify-compatible-demonstration-seed-1042",
      "dataset_version": {
        "schema_version": "1.0.0",
        "spotify_audio_features_reference_version": "1.0.0",
        "spotify_track_reference_version": "1.0.0"
      }
    },
    "control_inputs": {
      "dataset_id": "soundcharts-grounded-spotify-compatible-demonstration-seed-1042",
      "lifecycle_stage": "active_driving_content",
      "matrix_version": "v1",
      "motion_state": "driving",
      "trigger_purpose": "inattentive_driving_prevention_recovery"
    },
    "driver_profile": {
      "age_band": "30s",
      "cancelled_content_plans": [],
      "catalog_item_recency_state": {},
      "catalog_item_usage_level": {},
      "changed_from_items": [],
      "completed_items": [],
      "content_proposal_acceptance_confidence": {},
      "content_proposal_acceptance_rate": {},
      "content_recovery_confidence": {},
      "content_recovery_rate": {},
      "content_tag_recency_state": {},
      "content_tag_usage_level": {},
      "gender": "unspecified",
      "genre_affinity_v1_enabled": false,
      "hobby_interest_tags": [],
      "manually_selected_items": [],
      "oshi_artists": [],
      "oshi_mode": "off",
      "oshi_registered": false,
      "oshi_tags": [],
      "played_items": [],
      "repeated_items": [],
      "scene_content_tag_usage_level": {},
      "scene_genre_usage": null,
      "scene_service_usage_level": {},
      "scheduled_event_tags": [],
      "scheduled_event_timing": null,
      "scheduled_event_type": null,
      "service_proposal_acceptance_confidence": {},
      "service_proposal_acceptance_rate": {},
      "service_recency_state": {},
      "service_recovery_confidence": {},
      "service_recovery_rate": {},
      "service_usage_level": {},
      "skipped_items": [],
      "usage_by_genre": null
    },
    "situation": {
      "active_service": null,
      "child_present": false,
      "destination_tags": [],
      "drowsiness_level": 70,
      "estimated_min_until_rest_spot": null,
      "fatigue_level": 55,
      "monotony_level": 100,
      "motion_state": "driving",
      "multiple_passengers": false,
      "night_state": "day",
      "recent_service_rejections": [],
      "rest_spot_type": "unknown",
      "road_type": "highway",
      "route_tags": [
        "highway"
      ],
      "traffic_state": "congested"
    }
  }
}
