{
  "algorithm_config_overrides": null,
  "brief": {
    "en": "An hour later: traffic and monotony have built, drowsiness climbs to 55. Same blank profile, same child_present -- the SAME track that led stage 1 stays on top, but its fit score rises with the harder situation (situation moves fit magnitude, not identity).",
    "ja": "1時間後、渋滞と単調さが蓄積し眠気は55まで上昇。同じ空欄プロファイル、同じchild_present — ステージ1で首位だった同じ曲がそのまま首位を維持するが、状況が厳しくなるにつれフィットスコアは上昇する（状況はフィットの大きさを動かすが、識別は変えない）。"
  },
  "category": "situation",
  "contrast_with": null,
  "expectation": {
    "expected_service": {
      "top_should_be_in": [
        "humming_karaoke",
        "music_playlist",
        "radio_style"
      ]
    },
    "expected_top": {
      "arousal_band": "high",
      "track_id": "synthetic-track-0161"
    },
    "gradient": "none",
    "hypothesis": "same blank profile, same child_present, but drowsiness/monotony climb -> the SAME child track stays top, fit rises (situation raises fit magnitude, doesn't swap identity)",
    "override_required": false,
    "top_fit_min": 0.16
  },
  "family": "journey",
  "journey": {
    "id": "journey-e",
    "label": {
      "en": "E · E · The family road trip",
      "ja": "E・E・家族の遠出"
    },
    "of": 4,
    "step": 2
  },
  "label": {
    "en": "E · 2/4 — E · 2/4 — An hour in, restless",
    "ja": "E・2/4 — E・2/4 — 1時間経過、落ち着かない"
  },
  "preset_id": "preset-journey-e-2-hour-in-restless",
  "schema_version": "1.0.0",
  "world": {
    "catalog_ref": {
      "dataset_hash": "sha256:83d8079c7a81bc6afbd01cdba65fe2330de66b900a113723814fa938fce516cd",
      "dataset_id": "soundcharts-grounded-spotify-compatible-demonstration-seed-1042",
      "dataset_version": {
        "schema_version": "1.0.0",
        "spotify_audio_features_reference_version": "1.0.0",
        "spotify_track_reference_version": "1.0.0"
      }
    },
    "control_inputs": {
      "dataset_id": "soundcharts-grounded-spotify-compatible-demonstration-seed-1042",
      "lifecycle_stage": "active_driving_content",
      "matrix_version": "v1",
      "motion_state": "driving",
      "trigger_purpose": "child_passenger_experience"
    },
    "driver_profile": {
      "age_band": "30s",
      "cancelled_content_plans": [],
      "catalog_item_recency_state": {},
      "catalog_item_usage_level": {},
      "changed_from_items": [],
      "completed_items": [],
      "content_proposal_acceptance_confidence": {},
      "content_proposal_acceptance_rate": {},
      "content_recovery_confidence": {},
      "content_recovery_rate": {},
      "content_tag_recency_state": {},
      "content_tag_usage_level": {},
      "gender": "unspecified",
      "genre_affinity_v1_enabled": false,
      "hobby_interest_tags": [],
      "manually_selected_items": [],
      "oshi_id": null,
      "oshi_mode": "off",
      "oshi_registered": false,
      "oshi_tags": [],
      "oshi_type": null,
      "played_items": [],
      "repeated_items": [],
      "scene_content_tag_usage_level": {},
      "scene_genre_usage": null,
      "scene_service_usage_level": {},
      "scheduled_event_tags": [],
      "scheduled_event_timing": null,
      "scheduled_event_type": null,
      "service_proposal_acceptance_confidence": {},
      "service_proposal_acceptance_rate": {},
      "service_recency_state": {},
      "service_recovery_confidence": {},
      "service_recovery_rate": {},
      "service_usage_level": {},
      "skipped_items": [],
      "usage_by_genre": null
    },
    "situation": {
      "active_service": null,
      "child_present": true,
      "destination_tags": [],
      "drowsiness_level": 55,
      "estimated_min_until_rest_spot": null,
      "fatigue_level": 45,
      "monotony_level": 60,
      "motion_state": "driving",
      "multiple_passengers": true,
      "night_state": "day",
      "recent_service_rejections": [],
      "rest_spot_type": "unknown",
      "road_type": "highway",
      "route_tags": [
        "highway"
      ],
      "traffic_state": "normal"
    }
  }
}
