{
  "algorithm_config_overrides": null,
  "brief": {
    "en": "Morning highway drive, kids and multiple passengers aboard, driver profile completely blank (no oshi, no history, no genre usage). With no personalization signal at all, child_present alone is enough to pick a different, child-appropriate high-arousal track than an otherwise-identical adult-only drive would.",
    "ja": "朝の高速道路、子どもと複数の同乗者が乗車。ドライバープロファイルは完全に空欄（推し・履歴・ジャンル利用なし）。個人化シグナルが一切ない状態でも、child_present（子ども同乗）だけで、大人のみの同一状況とは異なる子ども向けの高覚醒な曲が選ばれる。"
  },
  "category": "situation",
  "contrast_with": null,
  "expectation": {
    "expected_service": {
      "top_should_be_in": [
        "humming_karaoke",
        "call_response_driving",
        "quiz",
        "ranking_creation"
      ]
    },
    "expected_top": {
      "arousal_band": "mid",
      "genre": "anime"
    },
    "gradient": "none",
    "hypothesis": "blank profile + child_present on a mild drive -> the child-appropriate high-arousal track tops via humming_karaoke, at a modest fit",
    "override_required": false,
    "top_fit_min": 0.124
  },
  "family": "journey",
  "journey": {
    "id": "journey-e",
    "label": {
      "en": "E · E · The family road trip",
      "ja": "E・E・家族の遠出"
    },
    "of": 4,
    "step": 1
  },
  "label": {
    "en": "E · 1/4 — E · 1/4 — Setting off",
    "ja": "E・1/4 — E・1/4 — 出発"
  },
  "preset_id": "preset-journey-e-1-setting-off",
  "schema_version": "1.0.0",
  "world": {
    "catalog_ref": {
      "dataset_hash": "sha256:83d8079c7a81bc6afbd01cdba65fe2330de66b900a113723814fa938fce516cd",
      "dataset_id": "soundcharts-grounded-spotify-compatible-demonstration-seed-1042",
      "dataset_version": {
        "schema_version": "1.0.0",
        "spotify_audio_features_reference_version": "1.0.0",
        "spotify_track_reference_version": "1.0.0"
      }
    },
    "control_inputs": {
      "dataset_id": "soundcharts-grounded-spotify-compatible-demonstration-seed-1042",
      "lifecycle_stage": "active_driving_content",
      "matrix_version": "v1",
      "motion_state": "driving",
      "trigger_purpose": "child_passenger_experience"
    },
    "driver_profile": {
      "age_band": "30s",
      "cancelled_content_plans": [],
      "catalog_item_recency_state": {},
      "catalog_item_usage_level": {},
      "changed_from_items": [],
      "completed_items": [],
      "content_proposal_acceptance_confidence": {},
      "content_proposal_acceptance_rate": {},
      "content_recovery_confidence": {},
      "content_recovery_rate": {},
      "content_tag_recency_state": {},
      "content_tag_usage_level": {},
      "gender": "unspecified",
      "genre_affinity_v1_enabled": false,
      "hobby_interest_tags": [],
      "manually_selected_items": [],
      "oshi_artists": [],
      "oshi_mode": "off",
      "oshi_registered": false,
      "oshi_tags": [],
      "played_items": [],
      "repeated_items": [],
      "scene_content_tag_usage_level": {},
      "scene_genre_usage": null,
      "scene_service_usage_level": {},
      "scheduled_event_tags": [],
      "scheduled_event_timing": null,
      "scheduled_event_type": null,
      "service_proposal_acceptance_confidence": {},
      "service_proposal_acceptance_rate": {},
      "service_recency_state": {},
      "service_recovery_confidence": {},
      "service_recovery_rate": {},
      "service_usage_level": {},
      "skipped_items": [],
      "usage_by_genre": null
    },
    "situation": {
      "active_service": null,
      "child_present": true,
      "destination_tags": [],
      "drowsiness_level": 30,
      "estimated_min_until_rest_spot": null,
      "fatigue_level": 25,
      "monotony_level": 35,
      "motion_state": "driving",
      "multiple_passengers": true,
      "night_state": "day",
      "recent_service_rejections": [],
      "rest_spot_type": "unknown",
      "road_type": "highway",
      "route_tags": [
        "highway"
      ],
      "traffic_state": "normal"
    }
  }
}
