{
  "algorithm_config_overrides": null,
  "brief": {
    "en": "Night has fallen and traffic thickens near the venue; drowsiness has crept to ~45 — still nowhere close to a rest trigger. She's finally arriving at the place she's dreamed about for months, and it's Miku's own song that plays her in the door.",
    "ja": "夜になり会場周辺は渋滞、眠気は約45までじわり上昇——それでも休憩トリガーにはまだ遠い。何ヶ月も夢見た場所へ、ついに到着。会場入りを飾るのは、ミク自身の曲。"
  },
  "category": "preference",
  "contrast_with": null,
  "expectation": {
    "expected_service": {
      "top_should_be_in": [
        "humming_karaoke",
        "music_playlist",
        "radio_style"
      ]
    },
    "expected_top": {
      "arousal_band": "high",
      "genre": null,
      "must_be_oshi": true,
      "track_id": "synthetic-track-0240"
    },
    "gradient": "none",
    "hypothesis": "arrival at the venue at night, drowsiness still mild (~45, no rest trigger reached) -> Miku's track remains on top throughout; preference, not tiredness, explains the whole arc",
    "override_required": false,
    "top_fit_min": 0.4
  },
  "family": "journey",
  "journey": {
    "id": "journey-f",
    "label": {
      "en": "F · The oshi pilgrimage",
      "ja": "F・推しの聖地巡礼"
    },
    "of": 3,
    "step": 3
  },
  "label": {
    "en": "F · 3/3 — Arriving at the venue, at night",
    "ja": "F・3/3 — 夜、会場に到着"
  },
  "preset_id": "preset-journey-f-3-arriving-venue-night",
  "schema_version": "1.0.0",
  "world": {
    "catalog_ref": {
      "dataset_hash": "sha256:83d8079c7a81bc6afbd01cdba65fe2330de66b900a113723814fa938fce516cd",
      "dataset_id": "soundcharts-grounded-spotify-compatible-demonstration-seed-1042",
      "dataset_version": {
        "schema_version": "1.0.0",
        "spotify_audio_features_reference_version": "1.0.0",
        "spotify_track_reference_version": "1.0.0"
      }
    },
    "control_inputs": {
      "dataset_id": "soundcharts-grounded-spotify-compatible-demonstration-seed-1042",
      "lifecycle_stage": "active_driving_content",
      "matrix_version": "v1",
      "motion_state": "driving",
      "trigger_purpose": "route_music"
    },
    "driver_profile": {
      "age_band": "teens",
      "cancelled_content_plans": [],
      "catalog_item_recency_state": {},
      "catalog_item_usage_level": {
        "synthetic-track-0108": "high",
        "synthetic-track-0215": "high",
        "synthetic-track-0240": "high"
      },
      "changed_from_items": [],
      "completed_items": [],
      "content_proposal_acceptance_confidence": {},
      "content_proposal_acceptance_rate": {
        "synthetic-track-0108": 95,
        "synthetic-track-0215": 95,
        "synthetic-track-0240": 95
      },
      "content_recovery_confidence": {},
      "content_recovery_rate": {
        "synthetic-track-0108": 90,
        "synthetic-track-0215": 90,
        "synthetic-track-0240": 90
      },
      "content_tag_recency_state": {},
      "content_tag_usage_level": {},
      "gender": "unspecified",
      "genre_affinity_v1_enabled": true,
      "hobby_interest_tags": [
        "anime-fan"
      ],
      "manually_selected_items": [],
      "oshi_id": "synthetic-artist-0115",
      "oshi_mode": "on",
      "oshi_registered": true,
      "oshi_tags": [],
      "oshi_type": "artist",
      "played_items": [],
      "repeated_items": [],
      "scene_content_tag_usage_level": {},
      "scene_genre_usage": null,
      "scene_service_usage_level": {},
      "scheduled_event_tags": [],
      "scheduled_event_timing": null,
      "scheduled_event_type": null,
      "service_proposal_acceptance_confidence": {},
      "service_proposal_acceptance_rate": {},
      "service_recency_state": {},
      "service_recovery_confidence": {},
      "service_recovery_rate": {},
      "service_usage_level": {},
      "skipped_items": [],
      "usage_by_genre": {
        "anime": "high",
        "j-pop": "med",
        "vocaloid": "high"
      }
    },
    "situation": {
      "active_service": null,
      "child_present": false,
      "destination_tags": [
        "event",
        "oshi_venue"
      ],
      "drowsiness_level": 45,
      "estimated_min_until_rest_spot": null,
      "fatigue_level": 28,
      "monotony_level": 25,
      "motion_state": "driving",
      "multiple_passengers": false,
      "night_state": "night",
      "recent_service_rejections": [],
      "rest_spot_type": "unknown",
      "road_type": "local",
      "route_tags": [
        "local"
      ],
      "traffic_state": "congested"
    }
  }
}
