{
  "algorithm_config_overrides": null,
  "brief": {
    "en": "An hour in, the monotonous highway has pushed drowsiness to ~62 and monotony to ~88. The assistant switches to keep-alert mode, doubling down on the same high-energy oshi track to fight the fade — with a wider margin now.",
    "ja": "1時間走行し、単調な高速道路で眠気62・モノトニー88まで上昇。アシスタントは注意喚起モードに切り替え、同じ高エネルギーな推し曲でさらに気を引き締める — 差はさらに開く。"
  },
  "category": "situation",
  "contrast_with": null,
  "expectation": {
    "expected_service": {
      "top_should_be_in": [
        "humming_karaoke",
        "call_response_driving",
        "quiz"
      ]
    },
    "expected_top": {
      "arousal_band": "high",
      "genre": "j-pop",
      "must_be_oshi": true,
      "track_id": "synthetic-track-0176"
    },
    "gradient": "arousal_up_implies_fit_up",
    "hypothesis": "drowsiness/monotony climbing on the same monotonous highway → assistant leans harder into energize; the same high-arousal oshi track holds top",
    "override_required": false,
    "top_fit_min": 0.38
  },
  "family": "journey",
  "journey": {
    "id": "journey-a",
    "label": {
      "en": "A · The Boring Commute",
      "ja": "A・退屈な通勤"
    },
    "of": 4,
    "step": 2
  },
  "label": {
    "en": "A · 2/4 — Drowsiness Building — Stay Alert",
    "ja": "A・2/4 — 眠気が高まる — 注意喚起"
  },
  "preset_id": "preset-journey-a-2-drowsiness-building-nudge",
  "schema_version": "1.0.0",
  "world": {
    "catalog_ref": {
      "dataset_hash": "sha256:83d8079c7a81bc6afbd01cdba65fe2330de66b900a113723814fa938fce516cd",
      "dataset_id": "soundcharts-grounded-spotify-compatible-demonstration-seed-1042",
      "dataset_version": {
        "schema_version": "1.0.0",
        "spotify_audio_features_reference_version": "1.0.0",
        "spotify_track_reference_version": "1.0.0"
      }
    },
    "control_inputs": {
      "dataset_id": "soundcharts-grounded-spotify-compatible-demonstration-seed-1042",
      "lifecycle_stage": "active_driving_content",
      "matrix_version": "v1",
      "motion_state": "driving",
      "trigger_purpose": "inattentive_driving_prevention_recovery"
    },
    "driver_profile": {
      "age_band": "30s",
      "cancelled_content_plans": [],
      "catalog_item_recency_state": {},
      "catalog_item_usage_level": {
        "synthetic-track-0176": "high",
        "synthetic-track-0177": "high",
        "synthetic-track-0183": "high"
      },
      "changed_from_items": [],
      "completed_items": [],
      "content_proposal_acceptance_confidence": {},
      "content_proposal_acceptance_rate": {
        "synthetic-track-0176": 88,
        "synthetic-track-0177": 90,
        "synthetic-track-0183": 97
      },
      "content_recovery_confidence": {},
      "content_recovery_rate": {
        "synthetic-track-0176": 85,
        "synthetic-track-0177": 88,
        "synthetic-track-0183": 95
      },
      "content_tag_recency_state": {},
      "content_tag_usage_level": {},
      "gender": "unspecified",
      "genre_affinity_v1_enabled": true,
      "hobby_interest_tags": [],
      "manually_selected_items": [],
      "oshi_id": "synthetic-artist-0157",
      "oshi_mode": "on",
      "oshi_registered": true,
      "oshi_tags": [],
      "oshi_type": "artist",
      "played_items": [],
      "repeated_items": [],
      "scene_content_tag_usage_level": {},
      "scene_genre_usage": null,
      "scene_service_usage_level": {},
      "scheduled_event_tags": [],
      "scheduled_event_timing": null,
      "scheduled_event_type": null,
      "service_proposal_acceptance_confidence": {},
      "service_proposal_acceptance_rate": {},
      "service_recency_state": {},
      "service_recovery_confidence": {},
      "service_recovery_rate": {},
      "service_usage_level": {},
      "skipped_items": [],
      "usage_by_genre": {
        "j-pop": "high",
        "j-rock": "med"
      }
    },
    "situation": {
      "active_service": null,
      "child_present": false,
      "destination_tags": [],
      "drowsiness_level": 62,
      "estimated_min_until_rest_spot": null,
      "fatigue_level": 30,
      "monotony_level": 88,
      "motion_state": "driving",
      "multiple_passengers": false,
      "night_state": "day",
      "recent_service_rejections": [],
      "rest_spot_type": "unknown",
      "road_type": "highway",
      "route_tags": [
        "highway"
      ],
      "traffic_state": "normal"
    }
  }
}
